<?xml version="1.0" encoding="UTF-8"?>
<!DOCTYPE format SYSTEM "mediation.dtd" >
<format>
    <field>
    	<name>accountcode</name>
    	<type>string</type>
    	<isKey/>
    </field>
    <field>
    	<name>src</name>
    	<type>string</type>
    </field>
    <field>
    	<name>dst</name>
    	<type>string</type>
    </field>
    <field>
    	<name>dcontext</name>
    	<type>string</type>
    </field>
    <field>
    	<name>clid</name>
    	<type>string</type>
    </field>
    <field>
    	<name>channel</name>
    	<type>string</type>
    </field>
    <field>
    	<name>dstchannel</name>
    	<type>string</type>
    </field>
    <field>
    	<name>lastapp</name>
    	<type>string</type>
    </field>
    <field>
    	<name>lastdata</name>
    	<type>string</type>
    </field>
    <field>
    	<name>start</name>
    	<type>date</type>
    </field>
    <field>
    	<name>answer</name>
    	<type>date</type>
    </field>
    <field>
    	<name>end</name>
    	<type>date</type>
    </field>
    <field>
    	<name>duration</name>
    	<type>integer</type>
    </field>
    <field>
    	<name>billsec</name>
    	<type>integer</type>
    </field>
    <field>
    	<name>disposition</name>
    	<type>string</type>
    </field>
    <field>
    	<name>amaflags</name>
    	<type>string</type>
    </field>
    <field>
    	<name>userfield</name>
    	<type>string</type>
    </field>
</format>
